search_id	construction_family	query_or_screen	candidate_source	outcome	use_or_exclusion_reason
R5-S01	classifier NP general	Cantonese bare classifier noun definiteness structure	Cheng and Sybesma 1999	INCLUDED_PRIMARY	Foundational peer-reviewed analysis of C-N distribution and NP structure; retained with later-variation limitation.
R5-S02	bare classifier NP	Cantonese bare classifiers definiteness subject object variation	Simpson, Soh, and Nomoto 2011	INCLUDED_PRIMARY	Peer-reviewed elicitation study explicitly defines bare classifier as C+N and documents variation.
R5-S03	demonstrative and possessive classifier NP	Cantonese nominal modifiers demonstrative classifier possessor classifier headless	Yu 2006	INCLUDED_CORROBORATIVE_ONLY	Exact illustrated forms and headless D+C contrast; unpublished, therefore not sole support for productivity.
R5-S04	classifier NP schemata	construction-based Cantonese classifiers D X C N C N	Bond and Sio 2024	INCLUDED_PRIMARY_WITH_ANALYSIS_LIMIT	Peer-reviewed implemented grammar with four explicit NP schemata; formal ontology not treated as uniquely settled.
R5-S05	overt segmentation and ellipsis	Cantonese word segmentation numeral classifier noun ellipsis possessive determiner	Lam, Lau, and Lee 2024	INCLUDED_CORROBORATIVE	Peer-reviewed corpus scheme gives exact overt boundaries and examples; not a complete syntactic theory.
R5-S06	classifier distribution and diagnostics	Cantonese classifiers measure words Num CL N Dem CL N noun ellipsis possessor CL N	Xia 2025	INCLUDED_PRIMARY_WITH_COMPETING_ANALYSIS	Recent comparative diagnostics, explicit Cantonese table, ellipsis and jat1 limits; structural proposal kept theory-neutral.
R5-S07	DemonstrativeHeadNP	screen runtime example 呢個蘋果 against source segmentation	runtime main.js + Bond/Sio + Lam et al.	MISMATCH_CONFIRMED	Runtime note treats 呢個 as demonstrative pronoun before 蘋果; sources segment 呢 + 個(CL) + 蘋果.
R5-S08	classifier-alone ellipsis	does bare classifier mean classifier alone in Cantonese research	reviewed source set	NO_SUPPORT_FOR_CLASSIFIER_ALONE_LABEL	Reviewed sources consistently use bare classifier for C+N without numeral. This blocks activation but does not prove classifier-alone forms are impossible in all contexts.
