search_id	date	query_or_action	source_or_engine	result	evidentiary_use	limitation
R32-S01	2026-07-19	Verify R31 research state and LX1 working-tree runtime hashes	local package inspection	PASS	dual-lineage baseline integrity	Package metadata is not linguistic authority.
R32-S02	2026-07-19	Rank ten remaining language labels by runtime and non-held-out accepted-fixture reach	coverage queue, main.js, slot model, and regression snapshots	PASS	family selection	Counts rank implementation impact only.
R32-S03	2026-07-19	Inspect coordination, ordinal, possession-transfer templates and dormant nominal labels	main.js and data/slot-model.json	PASS	runtime claim extraction	Code and registry labels are internal provenance only.
R32-S04	2026-07-19	Verify phrase coordination with 同/同埋 and juxtaposition	Wong 2023 full-text monograph	PASS	coordination marker inventory and ambiguity boundary	Clinical/developmental framework does not establish unrestricted adult productivity.
R32-S05	2026-07-19	Verify 第 ordinals and classifier-headed noun ellipsis	Lam, Lau, and Lee 2024 official ACL PDF	PASS	ordinal determiner and headless classifier evidence	Segmentation scheme is not a complete syntax.
R32-S06	2026-07-19	Verify lexicalized 第二 meaning next/another/other and conjunctive 同/同埋	user-provided 粵語（香港話）教程 full text	PASS	exact form and lexical ambiguity boundaries	Pedagogical source does not prove corpus frequency or parser nodes.
R32-S07	2026-07-19	Reconcile possessive 嘅, possessive classifier, headless nominal, 有, 要, and 畀 component evidence	existing verified Sio 2011, Yu 2006, Xia 2025, Lam et al. 2024, Luke and Nancarrow 1998, Li and Lee 2021 records	PASS	subtype and component boundaries	Component evidence does not establish the combined PossessiveTransferClause template.
R32-S08	2026-07-19	Assemble 30 claim-source rows and update five coverage records	local deterministic build	PASS	claim provenance	Matrix consistency is not linguistic truth.
R32-S09	2026-07-19	Run deterministic audit, aggregate regression, LX1 audit, and independent archive comparison	local validation and archive verification	PASS	artifact integrity	Artifact integrity does not validate grammar.
