runtime_surface	kind	current_origin_status	current_behavior_or_role	cp021b_overlap	preimplementation_disposition	future_owner	code_locator	risk_if_unchanged_or_misused	runtime_change_authorized
RecipientFrame	active_runtime_language_label	legacy_origin_not_proven	Combines recipient and beneficiary slots; learner text says receives or benefits; used for postverbal and bounded giving frames	Claims 001;003;004;006;008	REPLACE_OR_NEUTRALIZE_ONLY_AFTER_SEPARATE_DESIGN_FREEZE	CP021B-PI-C02	main.js:10699-10774;main.js:13317-13321;main.js:19703	Position can be mistaken for a recipient language fact and transfer can be collapsed with beneficiary or serial purpose	false
TransferDitransitiveVP	active_runtime_language_label	legacy_origin_not_proven	Assigns Theme and Recipient and currently permits theme-recipient or recipient-theme when visible NP typing supports it	Claims 002;003;005;006;008	NARROW_ONLY_AFTER_SEPARATE_DESIGN_FREEZE	CP021B-PI-C01	main.js:11079-11230;main.js:19739	Current role heuristics may overstate free alternation and assign evidence-scoped patterns as productive	false
PassivePermissiveRelation	active_provisional_runtime_language_label	legacy_source_linked_posthoc	Preserves passive permissive ambiguity and retained-patient candidates in the v0.5.174 unaccepted branch	Claims 001;007;008	DEFER_TO_CP020R2_RENDERED_OWNER	CP020R2	main.js:10921-11077;main.js:19762	CP021B could accidentally backdate origin or bypass required rendered acceptance if treated as independent validation	false
AffectednessFrame	retired_or_quarantined_runtime_label	legacy_origin_not_proven	Removed from active CP020 behavior but retained in legitimacy and retirement records	Claims 007;008	KEEP_RETIRED_NO_REVIVAL	CP020R2	main.js retirement and registry metadata;test-data/grammar-legitimacy-audit.tsv	A generic affectedness node would erase passive permissive ambiguity and repeat a rejected generalization	false
BenefactiveRecipientFrame	retired_label_alias	internal_alias_with_unsupported_replacement	Alias redirects to RecipientFrame with benefactive or transfer metadata	Claims 004;008	KEEP_RETIRED_AND_DO_NOT_USE_ALIAS_AS_EVIDENCE	CP021B-PI-C02	main.js:1258;main.js:1288;main.js:10726	The alias policy currently restates the unsupported beneficiary-recipient unification	false
SerialVerbPurposeChain	active_runtime_language_label	legacy_origin_not_proven	Contains a RecipientFrame subspan in a specific 攞…畀…purpose path and explicitly forbids hidden theme recipient or purpose	Claims 004;006	IMPACT_REVIEW_REQUIRED_NO_INDEPENDENT_REMEDIATION	CP021B-PI-C02	main.js:13090-13093;main.js:13308-13322	Changing RecipientFrame without auditing this consumer could lose the overt later predicate or invent roles	false
LEXICON_BIJ2_ORTHOGRAPHY	lexical_entries	legacy_internal_lexicon	畀 and 俾 share bei2 and GIVE notes, but several relevant runtime paths currently match only 畀	Claims 001;002;004	BINDING_ORTHOGRAPHIC_PARITY_INVARIANT	CP021B-PI-C01;CP021B-PI-C02	main.js:530-531;main.js:10705;main.js:10755;main.js:11086-11088	A future candidate could encode spelling-specific grammar not licensed by the evidence	false
DitransitiveSpeechVP	active_or_dormant_runtime_language_label	legacy_origin_not_proven	Separate LANE-08 speech ditransitive abstraction with no CP021B pattern-specific evidence	None direct	OUT_OF_SCOPE_REMAIN_QUARANTINED	NONE	archive/research-history/phase0-pre-status-reconciliation/grammar-claim-provenance-CP021A.tsv;test-data/grammar-legitimacy-audit.tsv	Lexical GIVE evidence must not be generalized to unrelated speech-predicate ditransitives	false
