edge_id	claim_id	claim_text	source_id	relation	verification_state	evidence_scope	limitation	acceptance_effect
PROG01-R3-E01	PROG01-R3-C01	Eight overt-object predicate/sense combinations have exact source support, but the evidence does not establish a free productive verb class.	SRC-KATAOKA-2018-PROGRESSIVE-GAN; SRC-FAN-2024-JAU-VP-ASPECT; SRC-ALDERETE-ETAL-2017-CANTONESE-GRAMMAR-SYNOPSIS; SRC-COI-DRINKING-WATER-2016-0111; SRC-IRC-BUS-2018-1006	supports_and_limits	VERIFIED_MULTI_SOURCE	predicate matrix PCM-01–PCM-08	Only 睇 and 食 have multiple documented object profiles in this packet.	seed_level_research_only
PROG01-R3-E02	PROG01-R3-C02	A closed action-verb boolean is not an adequate progressive-compatibility model.	SRC-KATAOKA-2018-PROGRESSIVE-GAN; SRC-SIO-BOND-2025	restricts_runtime_heuristic	VERIFIED_MULTI_SOURCE	objectless motion/state-like examples plus explicit situation-type/selection discussion	Does not itself provide a complete replacement classifier.	blocks_boolean_as_language_claim
PROG01-R3-E03	PROG01-R3-C03	Cantonese nominal expressions are head-final and allow preceding classifier/determiner and possessor material.	SRC-ALDERETE-ETAL-2017-CANTONESE-GRAMMAR-SYNOPSIS	supports_components	VERIFIED_UNIVERSITY_FULL_TEXT	pp. 35–36, examples (95)–(98)	Does not uniquely bracket every 啲 A 嘅 N string.	nominal_design_support
PROG01-R3-E04	PROG01-R3-C04	啲 di1 functions as a plural classifier in Cantonese nominal expressions.	SRC-WINTERSTEIN-ETAL-2023-NOMINAL-EXPRESSIONS	supports_component	VERIFIED_ACL_FULL_TEXT	section 2.1.2 and Table 1	No exact analysis of 啲 + possessor + 嘅 + head attachment.	nominal_design_support
PROG01-R3-E05	PROG01-R3-C05	啲九巴嘅數據 is attested in context, but the transcript does not prove a unique constituent bracketing.	SRC-IRC-BUS-2018-1006	attests_surface_not_bracketing	VERIFIED_OFFICIAL_TRANSCRIPT	transcript lines 1460–1462 and surrounding KMB-data discussion	Interpreted speech and no prosodic record in the PDF.	requires_ambiguity_aware_design
PROG01-R3-E06	PROG01-R3-C06	R2’s categorical claim that 啲公司嘅報告 must be 啲 [公司嘅報告] is not established.	SRC-ALDERETE-ETAL-2017-CANTONESE-GRAMMAR-SYNOPSIS; SRC-WINTERSTEIN-ETAL-2023-NOMINAL-EXPRESSIONS; PROJECT-CP023-P1-PROG01-R2-BASELINE	corrects_overclaim_by_scope_analysis	SUPPORTED_INFERENCE_NOT_DIRECT_SOURCE_JUDGMENT	two independently licensed component structures and ambiguous surface order	Native/prosodic testing may refine reading preferences.	supersedes_r2_current_diagnosis
PROG01-R3-E07	PROG01-R3-C07	Overt 同埋 coordinates XPs, including nominal phrases.	SRC-ALDERETE-ETAL-2017-CANTONESE-GRAMMAR-SYNOPSIS	supports	VERIFIED_UNIVERSITY_FULL_TEXT	pp. 40–41, examples (111)–(112)	Does not settle every 同/同埋 register or ambiguity condition.	supports_isolated_nominal_extension_design
PROG01-R3-E08	PROG01-R3-C08	問緊錫條同埋錫線 naturally instantiates a progressive predicate with an overt coordinated nominal object.	SRC-COI-DRINKING-WATER-2016-0111	natural_attestation	VERIFIED_OFFICIAL_TRANSCRIPT	PDF viewer p. 75; transcript lines 5241–5244	One token; no exact audio-linked 錫條 pronunciation.	supports_structure_but_quarantines_lexeme_pronunciation
