source_id	citation	source_type	url	locator	verification_state	use	limitation
SRC-KATAOKA-2018-PROGRESSIVE-GAN	Kataoka, Shin. 2018. 從早期和現代語料看粵語進行體標記「緊」在複句中的功能. Current Research in Chinese Linguistics 97(1):133–141.	peer-reviewed journal article with reported corpus examples	https://www.cuhk.edu.hk/ics/clrc/crcl_97_1/kataoka.pdf	pp. 134–137; examples (2)–(7), (10), and modern-corpus discussion	VERIFIED_OFFICIAL_FULL_TEXT	Progressive meaning; exact 睇緊電視, 着緊好靚嘅衫, 買緊樓; objectless 嚟緊 and 病緊; corpus 食緊叉燒包 and 整緊布甸.	Examples and corpus occurrences do not establish a free verb-by-object cross-product or parser constituency.
SRC-FAN-2024-JAU-VP-ASPECT	Fan, Xiaolei. 2024. 香港粵語「有 VP」的時體意義——兼論普通話的「沒」. Current Research in Chinese Linguistics 103(1):1–30.	peer-reviewed journal article	https://www.cuhk.edu.hk/ics/clrc/crcl_103_1/fan.pdf	pp. 4–8 and 22–23; examples and discussion of dynamic durative VPs, V緊/V住, 有+V緊, and future/modal boundary	VERIFIED_OFFICIAL_FULL_TEXT	Exact 唱緊首兒歌 and 食緊飯 examples; dynamic-durative discussion; disputed 有+V緊; one future/modal negative contrast.	The paper’s theoretical analysis and individual judgments are not adopted wholesale or generalized to all speakers.
SRC-SIO-BOND-2025	Sio, Joanna Ut-Seong, and Francis Bond. 2025. Inner and outer aspect in Cantonese. HPSG 2025.	peer-reviewed conference abstract/paper with computational analysis	https://dkaramasov.github.io/hpsg2025/assets/pdf/7-inner-and-outer-aspect-in-cantonese.pdf	section 1 and section 3.1; outer-aspect inventory and selectional restrictions	VERIFIED_PUBLISHED_FULL_TEXT	Confirms need to separate viewpoint aspect from situation type and treat selectional restrictions explicitly.	The implementation sketch is preliminary and explicitly non-exhaustive.
SRC-ALDERETE-ETAL-2017-CANTONESE-GRAMMAR-SYNOPSIS	Alderete, John, Queenie Chan, Macarius Chan, Gloria Fan, and Olivia Nickel. 2017. Cantonese grammar synopsis. Simon Fraser University.	university grammar synopsis cross-referenced to major grammars	https://www.sfu.ca/~alderete/pubs/aldereteEtal2017_cantgsyn2017-10-31.pdf	pp. 35–40; sections 6–8.1; examples (95), (98), (108), and (111)–(112)	VERIFIED_UNIVERSITY_FULL_TEXT	Head-final NP summary; possessor-before-head patterns; V-Asp-(NP); general XP coordination with 同埋 and NP coordination example.	A synopsis is not an exhaustive modern corpus study and uses a non-Jyutping transcription.
SRC-WINTERSTEIN-ETAL-2023-NOMINAL-EXPRESSIONS	Winterstein, Grégoire, et al. 2023. An empirical, corpus-based, approach to Cantonese nominal expressions. PACLIC 37.	peer-reviewed corpus paper	https://aclanthology.org/2023.paclic-1.43.pdf	pp. 2–3; section 2.1.2 and Table 1	VERIFIED_ACL_FULL_TEXT	Treats 啲 di1 as a plural classifier in [CL N]/[NUM CL N] nominal expressions and emphasizes context-conditioned nominal interpretation.	The paper does not analyze the exact attachment of 啲 + possessor + 嘅 + head strings.
SRC-COI-DRINKING-WATER-2016-0111	Commission of Inquiry into Excess Lead Found in Drinking Water. Hearing transcript, 2016-01-11.	official public-inquiry transcript	https://www.coi-drinkingwater.gov.hk/eng/pdf/transcript20160111.pdf	PDF viewer p. 75; transcript lines 5241–5244	VERIFIED_OFFICIAL_TRANSCRIPT	Direct occurrence of 問緊錫條同埋錫線.	One token; the transcript does not provide pronunciation or constituent analysis.
SRC-IRC-BUS-2018-1006	Independent Review Committee on Hong Kong’s Franchised Bus Service. Hearing transcript, 2018-10-06.	official interpreted-hearing transcript	https://www.irc-bus.gov.hk/chi/pdf/transcript20181006.pdf	PDF p. 43; transcript lines 1460–1462	VERIFIED_OFFICIAL_TRANSCRIPT	Occurrence of 我哋而家就睇緊啲九巴嘅數據 in context discussing KMB data.	Marked 經傳譯員; orthography and context support occurrence but not unique syntactic bracketing or spontaneous Cantonese production.
PROJECT-CP023-P1-PROG01-R2-BASELINE	Canto Span CP023-P1-PROG01-R2 visible parser observations.	internal reproducible diagnostic record	validation/cp023-p1-prog01/nominal-prerequisite-observation.json	NOM-P01–NOM-P07	VERIFIED_INTERNAL_RECORD	Documents current premature closure, missing 同埋 coordination, and whole-object progressive failures.	Parser output is evidence about implementation behavior, not Cantonese grammar.
