claim_id	claim_summary	runtime_overlap	preimplementation_disposition	candidate_or_owner	prerequisite	binding_constraint	rationale	runtime_change_authorized
CLAIM-CP021B-SY-001	BIJ2_POLYFUNCTIONAL_SURFACE_BOUNDARY	RecipientFrame;TransferDitransitiveVP;PassivePermissiveRelation	BINDING_CROSS_CANDIDATE_BOUNDARY	CP021B-PI-C01;CP021B-PI-C02;CP020R2	NATIVE_EXPERT_REVIEW_BEFORE_ANY_RUNTIME_ACCEPTANCE	SURFACE_BIJ2_ALONE_MUST_NOT_ASSIGN_FUNCTION_OR_PARTICIPANT_ROLE	The evidence supports function contrast, not one unified construction or exhaustive inventory.	false
CLAIM-CP021B-SY-002	LEXICAL_GIVE_THEME_RECIPIENT_PATTERN	TransferDitransitiveVP	BOUNDED_FUTURE_DESIGN_CANDIDATE_NOMINATED	CP021B-PI-C01	CP020R2_RENDERED_DISPOSITION;RELEVANT_DESIGN_ROWS_NATIVE_EXPERT_REVIEW;SEPARATE_PARSER_DESIGN_FREEZE	THEME_RECIPIENT_IS_ATTESTED_NOT_EXCLUSIVE_OR_FREELY_PRODUCTIVE	The lexical GIVE baseline is externally supported, but broad distribution and alternative order remain review-bearing.	false
CLAIM-CP021B-SY-003	ORDER_IS_LEXICAL_ROLE_AND_CONTEXT_CONDITIONED	TransferDitransitiveVP;RecipientFrame	DESIGN_CONSTRAINT_NO_GLOBAL_ALTERNATION	CP021B-PI-C01;CP021B-PI-C02	RELEVANT_DESIGN_ROWS_NATIVE_EXPERT_REVIEW;SEPARATE_PARSER_DESIGN_FREEZE	NO_SINGLE_GLOBAL_ORDER_OR_FREE_ALTERNATION	Predicate class, semantic role, weight, discourse, and speaker variation prohibit a global order switch.	false
CLAIM-CP021B-SY-004	POST_THEME_BIJ2_LINKING_PATTERN	RecipientFrame;SerialVerbPurposeChain	BOUNDED_FUTURE_DESIGN_CANDIDATE_NOMINATED	CP021B-PI-C02	CP020R2_RENDERED_DISPOSITION;RELEVANT_DESIGN_ROWS_NATIVE_EXPERT_REVIEW;SEPARATE_PARSER_DESIGN_FREEZE	POSTMARKER_NP_ROLE_DEPENDS_ON_UPSTREAM_PREDICATE_AND_VALENCY	The surface pattern is attested, but transfer, Goal, beneficiary, serial, and category analyses must remain distinct or unresolved.	false
CLAIM-CP021B-SY-005	HEAVY_THEME_ALTERNATIVES_UNSETTLED	TransferDitransitiveVP;RecipientFrame	NO_IMPLEMENTATION_RESEARCH_AND_REVIEW_REQUIRED	NONE	NEW_NATURAL_EVIDENCE;NATIVE_EXPERT_REVIEW;PREDECLARED_ANALYSIS_PLAN	NO_LENGTH_THRESHOLD_DOUBLE_MARKER_TRIGGER_OR_PRODUCTIVITY_RULE	The evidence records a tendency with conflicting judgments, sparse corpus cells, and no licensed threshold.	false
CLAIM-CP021B-SY-006	NONFULL_AND_RESTRUCTURED_REALIZATION_BOUNDARY	TransferDitransitiveVP;RecipientFrame;SerialVerbPurposeChain	REPRESENTATION_INVARIANT_ONLY_NO_NEW_LANGUAGE_NODE	CP021B-PI-C01;CP021B-PI-C02	CONTEXTUAL_REVIEW_BEFORE_ANY_SEMANTIC_ACCEPTANCE	NO_HIDDEN_PARTICIPANT_OR_LOCAL_FORM_UNGRAMMATICALITY_INFERENCE	Attested omission and restructuring justify caution, not participant invention or a productive parser rule.	false
CLAIM-CP021B-SY-007	CAUSATIVE_PASSIVE_CONTEXT_BOUNDARY	PassivePermissiveRelation;AffectednessFrame	DEFERRED_TO_EXISTING_RUNTIME_OWNER	CP020R2	CP020R2_RENDERED_60_ROW_DISPOSITION;LATER_PROVENANCE_RECONCILIATION	NO_RECIPIENT_ASSIGNMENT_FROM_NP2_POSITION_AND_NO_CP021B_PARALLEL_IMPLEMENTATION	CP020R2 already owns the provisional passive-permissive relation; CP021B evidence may later reconstruct provenance but cannot backdate origin or bypass rendered review.	false
CLAIM-CP021B-SY-008	NO_UNIFIED_RECIPIENT_REPRESENTATION_AUTHORIZED	RecipientFrame;TransferDitransitiveVP;PassivePermissiveRelation	BINDING_ARCHITECTURE_VETO	CP021B-PI-C01;CP021B-PI-C02;CP020R2	APPLIES_BEFORE_AND_AFTER_ALL_FUTURE_GATES	NO_RUNTIME_RELATION_SPANNING_TRANSFER_BENEFICIARY_CAUSATIVE_PERMISSIVE_AND_PASSIVE	This project representation disposition forbids recreating the unsupported legacy unification under a new label.	false
CLAIM-CP021B-SY-009	NO_CURRENT_UNRESTRICTED_FREQUENCY_MODEL	NONE	BINDING_EVIDENCE_AND_SCORING_VETO	NONE	FRESH_COMPARABLE_UTTERANCE_LEVEL_EVIDENCE_BEFORE_ANY_FREQUENCY_CLAIM	NO_FREQUENCY_PRIOR_THRESHOLD_OR_TEST_SET_RATE_INFERENCE	The available corpora, tasks, and samples do not support a current unrestricted-adult conversational frequency model.	false
