source_id	verification	citation_and_locator	what_it_supports	limit	disposition
SRC-WORDSHK-JYU5KEI4	VERIFIED_HONG_KONG_LEXICOGRAPHIC_RESOURCE	Words.hk, 與其 entry; https://words.hk/zidin/%E8%88%87%E5%85%B6	Jyutping jyu5 kei4; conjunction status; weighing alternatives; first member rejected/opposed; correlation with 不如; different-subject example.	One editorial example does not establish exhaustive syntax, register, or degree of preference.	PROMOTE_ORDERED_PREFERENCE_CORE
SRC-JYUTDICTIONARY-JYU5KEI4	VERIFIED_CANTONESE_LEXICOGRAPHIC_AGGREGATION	Jyut Dictionary, 與 entry, Cantonese examples lines 244-251 and 289-294; https://jyutdictionary.com/dictionary/entry/%E8%88%87	Fully romanized paired examples with repeated 話 predicates and optional 倒 before 不如.	The examples appear under a broad character entry and do not establish productivity or colloquial frequency.	SUPPORT_PREDICATE_PARALLELISM_AND_DOU2
SRC-EDB-P6-JYU5KEI4	VERIFIED_OFFICIAL_HONG_KONG_COURSE_MATERIAL	Hong Kong Education Bureau, Chinese Language 6 for non-Chinese-speaking students, Lesson 8, pp.15-16, accessible lines 180-191; https://www.edb.gov.hk/attachment/tc/curriculum-development/kla/chi-edu/second-lang/pri_package_student/P6_Ch8_SB.pdf	Explicit 與其…不如… exercise with activity, preparation, repair/purchase, and inquiry alternatives plus shared-subject placement.	The material teaches written Chinese and does not independently establish conversational Cantonese register or pronunciation.	SUPPORT_FORMAL_PRODUCTIVITY_WITH_REGISTER_LIMIT
SRC-CANTODICT-BAT1JYU4	VERIFIED_CANTONESE_LEXICOGRAPHIC_RESOURCE	CantoDict, 不如 entry; https://www.cantonese.sheik.co.uk/dictionary/words/2081/	Pronunciation bat1 jyu4 and separate suggestion versus not-as-good-as comparison senses.	The entry does not analyze the paired 與其 construction or define reliable parsing diagnostics.	SUPPORT_BAT1JYU4_POLYSEMY_BOUNDARY
RUNTIME-PRQ2-013-V0.5.213	VERIFIED_DIRECT_LOCAL_OBSERVATION	One-off analyzeLine/diagnosticFinalRows probes against main.js runtime 0.5.213; ten target and control surfaces; 2026-07-23	Generic linking, Suggest masking, ordinary-comparison overclassification, and distinct 寧願/empty controls.	Runtime output has zero linguistic-evidence weight and cannot prove naturalness or future ontology.	USE_FOR_COLLISION_AUDIT_ONLY
