source_id	verification	citation_and_locator	what_it_supports	limit	disposition
SRC-JYUTDICTIONARY-NING4JYUN6	VERIFIED_CANTONESE_LEXICOGRAPHIC_AGGREGATION	Jyut Dictionary, 寧願 entry, Cantonese examples lines 91-138; https://jyutdictionary.com/dictionary/entry/%E5%AF%A7%E9%A1%98	Jyutping ning4 jyun6; lexical preference; paired rejection with 都唔想 and 都唔肯; positive commitment with 都要; lone-preference controls.	Aggregated examples do not establish exhaustive syntax, productivity, or register.	PROMOTE_REJECTION_AND_COMMITMENT_PROFILES
SRC-EDB-DRAMA-NING4JYUN6	VERIFIED_OFFICIAL_HONG_KONG_DRAMA_MATERIAL	Hong Kong Education Bureau, Secondary School Chinese Drama Script 03, 2015-16, p.2; https://www.edb.gov.hk/attachment/en/public-admin/related-bodies-schemes/edu-schemes-fund/drama/Secondary%20scripts/2015-16_Chinese%20scripts/03.pdf	Colloquial shared-subject 寧願…都唔好… rejection surface.	One dramatic line cannot establish productivity or neutral register.	SUPPORT_DOU1_M4HOU2_PROFILE
SRC-CANTONESECLASS101-NING4JYUN6	VERIFIED_ROMANIZED_CANTONESE_LESSON	CantoneseClass101, Intermediate S1 lesson 13 notes, p.3; https://downloads-direct.freemdict.com/Language_Learning_Videos/%E8%8B%B1%E8%AF%AD%E5%AD%A6%E4%B9%A0%E7%B2%A4%E8%AF%AD/CantoneseClass101/Intermediate%20S1/Intermediate%20%2313%20-%20A%20Hong%20Kong%20Airline%20with%20a%20Bad%20Track%20Record%20-%20Lesson%20Notes%20Lite.pdf	Romanized shared-subject 寧願坐火車都唔想坐飛機 rejection example.	A pedagogical example does not establish all complement or polarity profiles.	SUPPORT_ROMANIZED_REJECTION_PROFILE
SRC-CANTODICT-NING4JYUN6	VERIFIED_CANTONESE_LEXICOGRAPHIC_RESOURCE	CantoDict, 寧願 entry; https://www.cantonese.sheik.co.uk/dictionary/words/11221/	Pronunciation ning4 jyun6/6*2 and lexical “would rather” sense.	The entry does not analyze the paired construction.	SUPPORT_LEXICAL_BOUNDARY
SRC-HKCANCOR-NING4JYUN6	VERIFIED_LOCAL_CORPUS_HIT	HKCanCor row HKC-04-00045 in research/corpora/hkcancor-1.0/source/sentences.tsv; 寧願自己俾錢睇私家醫生。	Independent conversational attestation of complete lone 寧願 preference.	The local corpus search did not supply a clean paired negative example.	KEEP_LONE_PREFERENCE_SEPARATE
RUNTIME-PRQ2-035-V0.5.213	VERIFIED_DIRECT_LOCAL_OBSERVATION	One-off analyzeLine/diagnosticFinalRows probes against main.js runtime 0.5.213; ten target and control surfaces; 2026-07-23	Generic linking, truncated local preference, member-only analyses, distinct 與其/情願 controls, and empty-marker guards.	Runtime output has zero linguistic-evidence weight and cannot prove naturalness or future ontology.	USE_FOR_COLLISION_AUDIT_ONLY
