source_id	verification	citation_and_locator	what_it_supports	limit	disposition
SRC-WORDSHK-MOU4LEON6	VERIFIED_HONG_KONG_LEXICOGRAPHIC_RESOURCE	Words.hk, 無論 entry; https://words.hk/zidin/%E7%84%A1%E8%AB%96	Jyutping mou4 leon6; conjunction status; no-matter semantics; wh and event-wh domains with 都 consequences.	Two editorial examples do not establish exhaustive domain types, marker optionality, or register.	PROMOTE_UNCONDITIONAL_CORE
SRC-HONGKONGVISION-MOU4LEON6	VERIFIED_CANTONESE_TEACHING_RESOURCE	Hong Kong Vision, 無論～都… lesson, lines 47-180; https://hongkongvision.com/archives/4580	Paired schema; wh, degree, A-not-A, different-subject, question, and negative profiles; stated register contrast with 唔理.	A Japanese-language teaching page is secondary evidence and cannot establish categorical register or full distribution.	SUPPORT_DOMAIN_VARIATION_AND_REGISTER_BOUNDARY
SRC-JYUTDICTIONARY-MOU4LEON6	VERIFIED_CANTONESE_LEXICOGRAPHIC_AGGREGATION	Jyut Dictionary, 無論 entry, Cantonese examples lines 91-155; https://jyutdictionary.com/dictionary/entry/%E7%84%A1%E8%AB%96	Fully romanized Cantonese wh, locative, degree, and explicit 定係 alternative domains with invariant 都 consequences.	Aggregated examples do not establish frequency, productivity, or that every displayed profile is equally colloquial.	SUPPORT_ALTERNATIVE_DOMAIN_RANGE
SRC-EDB-DRAMA-MOU4LEON6	VERIFIED_OFFICIAL_HONG_KONG_HOSTED_CANTONESE_TEXT	Hong Kong Education Bureau, Hong Kong School Drama Festival 2017/18 script 3, p.7, accessible lines 174-194; https://www.edb.gov.hk/attachment/en/public-admin/related-bodies-schemes/edu-schemes-fund/drama/Primary%20scripts/2017-18_Chinese%20scripts/3.pdf	Authored colloquial dialogue 無論你身處邊度，都可以… with a locative wh-domain and modal consequence.	A dramatic script is not a representative speech corpus or controlled acceptability study.	SUPPORT_NATURAL_LOCATIVE_PROFILE
RUNTIME-PRQ2-034-V0.5.213	VERIFIED_DIRECT_LOCAL_OBSERVATION	One-off analyzeLine/diagnosticFinalRows probes against main.js runtime 0.5.213; ten target and control surfaces; 2026-07-23	Absent target typing, partial local coverage, and distinct free-choice, scalar-concessive, informal-variant, and fragment controls.	Runtime output has zero linguistic-evidence weight and cannot prove naturalness or future ontology.	USE_FOR_COLLISION_AUDIT_ONLY
